{
  "$schema": "http://json-schema.org/draft-07/schema#",
  "$id": "https://github.com/nhanthuytech/ats-protocol/spec/flow_graph_schema.json",
  "title": "ATS Flow Graph V6",
  "description": "Schema for flow_graph.json — the DAG-based knowledge graph used by ATS Protocol to map business logic flows to code.",
  "type": "object",
  "required": ["ats_version", "project", "flows"],
  "properties": {
    "ats_version": {
      "type": "string",
      "description": "ATS protocol version. Follows semver.",
      "example": "6.0.0"
    },
    "project": {
      "type": "string",
      "description": "Project name. Should match the Flutter package name.",
      "example": "my_flutter_app"
    },
    "updated_at": {
      "type": "string",
      "format": "date-time",
      "description": "ISO 8601 timestamp of the last update. AI updates this when modifying the graph."
    },
    "global_classes": {
      "type": "object",
      "description": "Shared classes that are auto-included when ANY flow is active. Use for cross-cutting services like AuthService, AnalyticsService, DataService. Declared once, traced across all flows.",
      "additionalProperties": {
        "oneOf": [
          {
            "type": "array",
            "items": { "type": "string" },
            "description": "V3 format: list of method names."
          },
          {
            "$ref": "#/definitions/ClassEntry"
          }
        ]
      }
    },
    "flows": {
      "type": "object",
      "description": "Map of flow names to their definitions. Flow names should be SCREAMING_SNAKE_CASE.",
      "additionalProperties": {
        "$ref": "#/definitions/FlowEntry"
      }
    },
    "edges": {
      "type": "array",
      "description": "Method-level call chain edges. Accumulated over time as AI discovers call paths during debugging.",
      "items": {
        "$ref": "#/definitions/Edge"
      }
    }
  },
  "definitions": {
    "FlowEntry": {
      "type": "object",
      "required": ["description", "active", "classes"],
      "properties": {
        "description": {
          "type": "string",
          "description": "Human-readable description of what this flow represents."
        },
        "active": {
          "type": "boolean",
          "description": "Whether ATS.trace() logs are enabled for this flow.",
          "default": false
        },
        "priority": {
          "type": "string",
          "enum": ["high", "normal", "low"],
          "default": "normal",
          "description": "Flow priority for log filtering. 'high' = always trace when active, 'normal' = default, 'low' = only trace when ATS_LOG_LEVEL=low."
        },
        "depends_on": {
          "type": "array",
          "items": { "type": "string" },
          "description": "Flow-level DAG: list of flow names this flow depends on. Must not form cycles."
        },
        "parent": {
          "type": "string",
          "description": "Parent flow name for sub-flow hierarchy. A flow can have at most one parent."
        },
        "tags": {
          "type": "array",
          "items": { "type": "string" },
          "description": "Optional tags for categorization.",
          "example": ["critical", "3rd-party", "auth"]
        },
        "classes": {
          "type": "object",
          "description": "Maps class names to method info. Supports both V3 array format and V4+ object format.",
          "additionalProperties": {
            "oneOf": [
              {
                "type": "array",
                "items": { "type": "string" },
                "description": "V3 format: list of method names."
              },
              {
                "$ref": "#/definitions/ClassEntry"
              }
            ]
          }
        },
        "known_issues": {
          "type": "array",
          "items": { "type": "string" },
          "description": "AI-maintained list of known bugs or gotchas in this flow."
        },
        "last_debugged": {
          "type": "string",
          "format": "date",
          "description": "ISO 8601 date of the last debug session for this flow."
        },
        "sessions": {
          "type": "array",
          "description": "AI debug session history. Institutional memory across sessions.",
          "items": {
            "$ref": "#/definitions/SessionEntry"
          }
        }
      }
    },
    "ClassEntry": {
      "type": "object",
      "required": ["methods"],
      "properties": {
        "methods": {
          "type": "array",
          "items": { "type": "string" },
          "description": "List of method names that belong to this flow."
        },
        "muted": {
          "type": "array",
          "items": { "type": "string" },
          "description": "Methods that are suppressed from logging. trace() calls remain in code but produce no output. Must be a subset of 'methods'."
        },
        "needs_verify": {
          "type": "boolean",
          "description": "If true, AI should verify source code matches graph before trusting it.",
          "default": false
        },
        "last_verified": {
          "type": "string",
          "format": "date",
          "description": "ISO 8601 date when AI last confirmed this class matches source code."
        }
      }
    },
    "Edge": {
      "type": "object",
      "required": ["from", "to", "type"],
      "properties": {
        "from": {
          "type": "string",
          "description": "Source method in 'ClassName.methodName' format."
        },
        "to": {
          "type": "string",
          "description": "Target method in 'ClassName.methodName' format."
        },
        "type": {
          "type": "string",
          "enum": ["calls", "delegates", "emits", "navigates"],
          "description": "Relationship type between methods."
        },
        "trigger": {
          "type": "string",
          "enum": ["user_tap", "user_input", "api_response", "bloc_event", "lifecycle", "timer", "system"],
          "description": "What triggers this edge. Helps AI understand causality."
        },
        "state_impact": {
          "type": "string",
          "description": "Name of the state variable affected by this call. Helps AI understand side effects during debugging."
        },
        "condition": {
          "type": "string",
          "description": "Optional condition when this edge is taken."
        }
      }
    },
    "SessionEntry": {
      "type": "object",
      "required": ["date", "action", "note"],
      "properties": {
        "date": {
          "type": "string",
          "format": "date",
          "description": "ISO 8601 date of the session."
        },
        "action": {
          "type": "string",
          "enum": ["debug", "refactor", "update", "feature"],
          "description": "What kind of work was done."
        },
        "note": {
          "type": "string",
          "description": "Brief description of what was done and why."
        },
        "resolved": {
          "type": "boolean",
          "description": "Whether the issue was resolved in this session."
        }
      }
    }
  }
}
