{
  "ats_version": "4.0.0",
  "project": "shopify_clone",
  "updated_at": "2026-04-16T08:46:39.433Z",
  "flows": {
    "AUTH_FLOW": {
      "description": "User authentication and session management",
      "active": false,
      "classes": {
        "AuthBloc": {
          "methods": [
            "onLoginRequested",
            "onLogoutRequested",
            "onTokenRefresh",
            "onBiometricAuth"
          ],
          "last_verified": "2026-04-16"
        },
        "AuthService": {
          "methods": [
            "login",
            "logout",
            "refreshToken",
            "validateSession"
          ],
          "last_verified": "2026-04-16"
        },
        "TokenStorage": {
          "methods": [
            "saveTokens",
            "getAccessToken",
            "getRefreshToken",
            "clearTokens"
          ],
          "last_verified": "2026-04-16"
        },
        "BiometricService": {
          "methods": [
            "authenticate",
            "isAvailable",
            "enroll"
          ],
          "last_verified": "2026-04-15"
        }
      },
      "known_issues": [
        "Token refresh race condition when multiple API calls fail simultaneously"
      ],
      "sessions": [
        {
          "date": "2026-04-15",
          "action": "debug",
          "note": "Fixed: Concurrent 401s triggered multiple token refreshes. Added mutex lock.",
          "resolved": true
        }
      ]
    },
    "PRODUCT_FLOW": {
      "description": "Product catalog browsing and search",
      "active": false,
      "depends_on": [
        "AUTH_FLOW"
      ],
      "classes": {
        "ProductBloc": {
          "methods": [
            "onLoadProducts",
            "onSearchQuery",
            "onFilterChanged",
            "onSortChanged",
            "onLoadMore"
          ],
          "last_verified": "2026-04-16"
        },
        "ProductRepository": {
          "methods": [
            "getProducts",
            "searchProducts",
            "getProductById",
            "getCategories"
          ],
          "last_verified": "2026-04-16"
        },
        "ProductApi": {
          "methods": [
            "fetchProducts",
            "fetchSearch",
            "fetchProduct",
            "fetchCategories"
          ],
          "last_verified": "2026-04-16"
        },
        "ProductCache": {
          "methods": [
            "getCached",
            "setCached",
            "invalidate",
            "warmUp"
          ],
          "last_verified": "2026-04-14"
        },
        "SearchService": {
          "methods": [
            "search",
            "getSuggestions",
            "trackQuery",
            "clearHistory"
          ],
          "last_verified": "2026-04-16"
        }
      },
      "sessions": [
        {
          "date": "2026-04-14",
          "action": "debug",
          "note": "Pagination breaking when filter changes mid-scroll. Reset page index on filter change.",
          "resolved": true
        }
      ]
    },
    "CART_FLOW": {
      "description": "Shopping cart management",
      "active": true,
      "depends_on": [
        "PRODUCT_FLOW",
        "AUTH_FLOW"
      ],
      "classes": {
        "CartBloc": {
          "methods": [
            "onAddItem",
            "onRemoveItem",
            "onUpdateQuantity",
            "onClearCart",
            "onApplyVoucher"
          ],
          "last_verified": "2026-04-16"
        },
        "CartRepository": {
          "methods": [
            "getCart",
            "addToCart",
            "removeFromCart",
            "updateQuantity",
            "syncWithServer"
          ],
          "last_verified": "2026-04-16"
        },
        "CartService": {
          "methods": [
            "calculateTotal",
            "validateCart",
            "mergeGuestCart",
            "getShippingEstimate"
          ],
          "last_verified": "2026-04-16"
        },
        "VoucherService": {
          "methods": [
            "validateVoucher",
            "applyVoucher",
            "removeVoucher",
            "getAvailableVouchers"
          ],
          "last_verified": "2026-04-15"
        }
      },
      "known_issues": [
        "Guest cart merge loses voucher on login",
        "Shipping estimate stale after address change"
      ],
      "sessions": [
        {
          "date": "2026-04-16",
          "action": "debug",
          "note": "Investigating: cart total recalculation not triggered after voucher removal",
          "resolved": false
        }
      ]
    },
    "CHECKOUT_FLOW": {
      "description": "Checkout process from cart to order confirmation",
      "active": true,
      "depends_on": [
        "CART_FLOW",
        "PAYMENT_FLOW",
        "SHIPPING_FLOW"
      ],
      "classes": {
        "CheckoutBloc": {
          "methods": [
            "onCheckoutStarted",
            "onAddressSelected",
            "onShippingSelected",
            "onPaymentConfirmed",
            "onOrderPlaced"
          ],
          "last_verified": "2026-04-16",
          "muted": [
            "onShippingSelected"
          ]
        },
        "CheckoutService": {
          "methods": [
            "createOrder",
            "validateCheckout",
            "calculateFinalPrice",
            "reserveInventory"
          ],
          "last_verified": "2026-04-16"
        },
        "OrderRepository": {
          "methods": [
            "createOrder",
            "getOrder",
            "getOrderHistory",
            "cancelOrder"
          ],
          "last_verified": "2026-04-16"
        },
        "InventoryService": {
          "methods": [
            "checkAvailability",
            "reserveItems",
            "releaseReservation"
          ],
          "last_verified": "2026-04-15"
        }
      },
      "sessions": [
        {
          "date": "2026-04-15",
          "action": "debug",
          "note": "Race condition: inventory reserved but payment failed, reservation not released. Added rollback.",
          "resolved": true
        },
        {
          "date": "2026-04-16",
          "action": "debug",
          "note": "Checkout button stays disabled after address validation error clears",
          "resolved": false
        }
      ]
    },
    "PAYMENT_FLOW": {
      "description": "Payment processing with multiple gateways",
      "active": true,
      "depends_on": [
        "AUTH_FLOW"
      ],
      "classes": {
        "PaymentBloc": {
          "methods": [
            "onPaymentMethodSelected",
            "onPaymentSubmitted",
            "onPaymentResult"
          ],
          "last_verified": "2026-04-16"
        },
        "PaymentService": {
          "methods": [
            "processPayment",
            "refund",
            "getPaymentMethods",
            "validateCard"
          ],
          "last_verified": "2026-04-16"
        },
        "StripeGateway": {
          "methods": [
            "charge",
            "createIntent",
            "confirmPayment",
            "handleWebhook"
          ],
          "last_verified": "2026-04-16"
        },
        "MoMoGateway": {
          "methods": [
            "createPayment",
            "verifyPayment",
            "handleCallback"
          ],
          "last_verified": "2026-04-14"
        },
        "ReceiptService": {
          "methods": [
            "generateReceipt",
            "sendEmail",
            "generatePdf"
          ],
          "last_verified": "2026-04-16"
        }
      },
      "known_issues": [
        "MoMo callback sometimes arrives before redirect completes",
        "Stripe webhook retry causes duplicate receipt emails"
      ]
    },
    "SHIPPING_FLOW": {
      "description": "Shipping address management and delivery estimation",
      "active": false,
      "depends_on": [
        "AUTH_FLOW"
      ],
      "classes": {
        "ShippingBloc": {
          "methods": [
            "onLoadAddresses",
            "onAddAddress",
            "onSelectAddress",
            "onEstimateDelivery"
          ],
          "last_verified": "2026-04-16"
        },
        "AddressRepository": {
          "methods": [
            "getAddresses",
            "saveAddress",
            "deleteAddress",
            "setDefault"
          ],
          "last_verified": "2026-04-16"
        },
        "ShippingCalculator": {
          "methods": [
            "estimateDelivery",
            "calculateShippingFee",
            "getAvailableCarriers"
          ],
          "last_verified": "2026-04-15"
        },
        "GeocodingService": {
          "methods": [
            "geocode",
            "reverseGeocode",
            "validateAddress"
          ],
          "last_verified": "2026-04-14"
        }
      }
    },
    "NOTIFICATION_FLOW": {
      "description": "Push notifications and in-app messaging",
      "active": false,
      "depends_on": [
        "AUTH_FLOW"
      ],
      "classes": {
        "NotificationBloc": {
          "methods": [
            "onNotificationReceived",
            "onMarkRead",
            "onLoadHistory",
            "onClearAll"
          ],
          "last_verified": "2026-04-16"
        },
        "NotificationService": {
          "methods": [
            "registerDevice",
            "unregisterDevice",
            "getHistory",
            "markAsRead"
          ],
          "last_verified": "2026-04-16"
        },
        "FirebaseMessaging": {
          "methods": [
            "initialize",
            "handleForeground",
            "handleBackground",
            "getToken"
          ],
          "last_verified": "2026-04-15"
        },
        "DeepLinkHandler": {
          "methods": [
            "parseLink",
            "navigateToTarget",
            "handleDeferredLink"
          ],
          "last_verified": "2026-04-14"
        }
      }
    },
    "ANALYTICS_FLOW": {